{
  "event_id": "20000000-0000-5000-8000-000000000002",
  "tenant_id": "festival-thesis-demo",
  "run_id": "festival-guided-001",
  "actor_id": "editor-a",
  "source_type": "automation",
  "source_adapter": "festival-activity-log-v1",
  "build_id": "festnest-demo-001",
  "environment_id": "festnest-local-browser",
  "context": { "role": "editor", "module": "supply-list", "connectivity": "stale", "scenario_id": "equipment-handoff-v1" },
  "route": "/trips/10000000-0000-4000-8000-000000000001/supply-list",
  "state_fingerprint": "supply-list:item:10000000-0000-4000-8000-000000000101:status:packed",
  "action_type": "supply_item_packed",
  "outcome": "ambiguous",
  "verifier_result": "first_refresh_suppressed",
  "occurred_at": "2026-08-22T15:02:00Z",
  "step_index": 4,
  "privacy": { "masked": true, "redacted_fields": ["activity_logs.description"] }
}
